{
  "$schema": "https://json-schema.org/draft/2020-12/schema",
  "title": "IncidentException",
  "type": "object",
  "required": [
    "version",
    "model",
    "purpose",
    "required_fields",
    "severity_values",
    "exception_type_values",
    "status_values",
    "hard_rules"
  ],
  "properties": {
    "version": {
      "type": "string",
      "const": "v0.7"
    },
    "model": {
      "type": "string",
      "const": "incident-exception"
    },
    "purpose": {
      "type": "string",
      "minLength": 1
    },
    "required_fields": {
      "type": "array",
      "minItems": 12,
      "items": {
        "type": "string",
        "pattern": "^[a-z0-9][a-z0-9_]*$"
      }
    },
    "severity_values": {
      "type": "array",
      "minItems": 1,
      "items": {
        "type": "string",
        "minLength": 1
      }
    },
    "exception_type_values": {
      "type": "array",
      "minItems": 1,
      "items": {
        "type": "string",
        "minLength": 1
      }
    },
    "status_values": {
      "type": "array",
      "minItems": 1,
      "items": {
        "type": "string",
        "minLength": 1
      }
    },
    "hard_rules": {
      "type": "array",
      "minItems": 1,
      "items": {
        "type": "string",
        "minLength": 1
      }
    }
  },
  "additionalProperties": false
}
